{
  "capabilities": [
    "RESERVABLE"
  ],
  "connectors": [
    {
      "amperage": 16,
      "format": "SOCKET",
      "id": "1",
      "last_updated": "2015-06-29T20:39:09Z",
      "power_type": "AC_3_PHASE",
      "standard": "IEC_62196_T2",
      "tariff_id": "14",
      "voltage": 220
    }
  ],
  "evse_id": "BE-BEC-E041503003",
  "floor_level": "-1",
  "last_updated": "2015-06-29T20:39:09Z",
  "physical_reference": "3",
  "status": "AVAILABLE",
  "uid": "3256"
}
